{
  "change_history": [
    {
      "actor": "registry-bootstrap",
      "from": null,
      "to": "draft",
      "ts": "2026-09-25T00:00:00Z"
    }
  ],
  "detection_id": "anomaly-flow-volume",
  "manifest_ref": "detections/manifest/anomaly-detector.manifest.json",
  "source": "anomaly",
  "status": "draft",
  "version": "0.1.0"
}
