{
  "change_history": [
    {
      "actor": "registry-bootstrap",
      "from": null,
      "to": "draft",
      "ts": "2026-09-01T00:00:00Z"
    },
    {
      "actor": "carter",
      "from": "draft",
      "to": "shadow",
      "ts": "2026-09-15T00:00:00Z"
    }
  ],
  "detection_id": "behavioral-beacon",
  "manifest_ref": "detections/manifest/behavioral-detectors.manifest.json",
  "source": "behavioral",
  "status": "shadow",
  "version": "2.3.1"
}
